date	experimenter	variable	setting	time_budget_min	n_runs	primary_metric	primary_value	secondary_p95_s	secondary_temp_c	verdict	notes
2026-09-18	example	model	qwen2.5:3b-instruct-q4_K_M	10	1	structured_output_success_rate	1.0			keep	예시 행 — 실제 실험 기록 시 이 줄은 지우지 말고 아래에 추가만 할 것
2026-09-18	cursor	power_mode	25W	15	20	structured_output_success_rate	1.0	1.2461	45.6	keep	planB qwen2.5:3b-instruct-q4_K_M; raw=/home/jetson/shiftlink-bench/power_25W_20260918_142740.jsonl; preflight check done
2026-09-18	cursor	power_mode	15W	15	20	structured_output_success_rate	1.0	1.2574	46.6	keep	planB qwen2.5:3b-instruct-q4_K_M; raw=/home/jetson/shiftlink-bench/power_15W_20260918_143837.jsonl; preflight check done; vscode-server pkill 후 측정
2026-09-18	cursor	model	planB_heavy_15W (qwen2.5:3b-instruct-q4_K_M, long prompt)	15	20	format_success_rate	0.65	59.07(보고값)/약34(재로드 2건 제외)	62.6(tj_c_mean)	discard	오염됨 — i=1,3 두 건에서 모델 강제 재로드(load_duration_s 46.28/47.09) 발생, 원인은 15:00:29 임베딩 모델 로드 시도 cudaMalloc OOM. 재로드 제외 시 p95≈34s, TTFT≈0.1s(보고값 4.8s는 재로드로 왜곡). 실패 7건 중 6건은 재로드와 무관(출력 상한 768토큰 추정, 원문 미저장이라 확정 아님). raw=/home/jetson/shiftlink-bench/llm_planB_heavy_15W_20260918_145954.jsonl. **재측정 필요 — 측정 중 Jetson에서 타 프로세스(모델 로드) 금지.**
2026-09-18	cursor	model	planC_heavy_15W (exaone3.5:2.4b-instruct-q4_K_M, long prompt)	15	20	format_success_rate	1.0	21.37	62.9(tj_c_mean)	keep	재로드 없음(전 레코드 load_duration_s<1s) — 오염 없는 깨끗한 데이터. TTFT 평균 0.121s. planB_heavy_15W(위 행, discard)와 직접 비교는 보류 — 그쪽이 재측정 전까지는 공정 비교 불가. raw=/home/jetson/shiftlink-bench/llm_planC_heavy_15W_20260918_152150.jsonl
2026-09-24	허재원	model	planB_PC_CPU (qwen2.5:3b-instruct-q4_K_M, shiftlink.edge 어댑터, /api/chat format=JSON스키마)	30	3	structured_output_success_rate	1.0	10.375	-	keep	PC(Windows, i5-1035G1, 내장 UHD만 있어 ollama ps 기준 100% CPU) 실행. ollama 0.34.3(models.lock 고정값 0.34.1과 다름 — winget 최신), digest 357c53fb659c는 lock과 일치. 코드 기준 3c03b83(PR#52, 인용 검증·보류 반영 후). 입력=eval/fixtures/dev/category_f_e2e.json의 query 5케이스 중 실제 모델이 불린 3건(002·003은 검색 카드 0건이라 no_knowledge 게이트가 모델 호출을 차단 — wall_s=0.000 확인, 측정 제외. 004는 handover라 어댑터가 계약 §2대로 NotImplementedError로 거부). 지연(s): 001=10.406 005=10.094 006=9.750, p95는 n=3 선형보간. 3건 모두 {answer,cited_card_ids} 스키마로 파싱 성공, 인용 ID도 검색 결과와 일치(001/006→K-0108, 005→K-0200), A의 validate_model_output도 통과해 review_queue 미발생. keep_alive는 정수 -1이어야 함 — 문자열 "-1"은 400 'missing unit in duration'. 온도 미측정(PC에 Jetson tj 센서 없음). 실행: PYTHONPATH=".test-deps;." python -m shiftlink.edge --case F-e2e-001
2026-09-30	claude	retrieval	baseline (main f0e20fa, KB 41장)	0.1	1	dev_route_acc	18/30			baseline	autoresearch/retr-0930; t4 5/20; sanity 26/30
2026-09-30	claude	retrieval	E1 한 글자 토큰 제외	0.1	1	dev_route_acc	18/30			discard	62466c4; t4 5/20; sanity 26/30; 변화 없음
2026-09-30	claude	retrieval	E2 흔한 단어(카드 20% 초과) 질의에서 제외	0.1	1	dev_route_acc	19/30			keep	561b49e; t4 5/20; sanity 28/30
2026-09-30	claude	retrieval	E3 본문 겹침 어간 기준	0.1	1	dev_route_acc	17/30			discard	dca44d0; t4 5/20; sanity 28/30; 모름 오판 증가
2026-09-30	claude	retrieval	E4 제목·증상 가중 2→3	0.1	1	dev_route_acc	16/30			discard	7c3adee; t4 6/20; sanity 26/30
2026-09-30	claude	retrieval	E5 부품명을 제목·증상 가중에 포함	0.1	1	dev_route_acc	19/30			discard	3fb6071; t4 4/20; sanity 28/30; 동점·코드 증가
2026-09-30	claude	retrieval	E6 흔한 단어 기준 20%→10%	0.1	1	dev_route_acc	21/30			discard	3f39431; t4 4/20; sanity 29/30; 인계 모드 실KB 테스트 실패(T4 후보 소실), 답 있는 문항 3건 손실
2026-09-30	claude	retrieval	E7 동점 시 제목·증상 일치 우선	0.1	1	dev_route_acc	19/30			discard	4c631b5; t4 6/20(+1); sanity 28/30; 동점·코드 증가 — 인계 개선 후보로 보관
2026-09-30	claude	retrieval	E8 현장어 동의어 질의 확장	0.1	1	dev_route_acc	20/30			keep	ac95be1; t4 5/20; sanity 28/30; 동의어 일부는 개발용 오답을 보고 고름 → 낙관 가능
2026-10-01	claude	model×cand_format	exaone3.5:2.4b base (후보 5장, ID)	5	31	sel_at_1	5/29	10.12		discard	검색 1위 28/29. 카드 62장. docs/reports/model-selection-20261001.md
2026-10-01	claude	model×cand_format	exaone3.5:2.4b v1 인용 먼저	5	31	sel_at_1	9/29	6.61		discard	
2026-10-01	claude	model×cand_format	exaone3.5:2.4b v2 번호	5	31	sel_at_1	20/29	6.37		discard	8문항마다 재적재(메모리 우회), 재적재 문항 제외 p95
2026-10-01	claude	model×cand_format	exaone3.5:2.4b v3 번호+색인만	3	31	sel_at_1	22/29	3.73		discard	방식 중 최고지만 검색 1위 미만. 우회 실행 23/29
2026-10-01	claude	model×cand_format	exaone3.5:2.4b v4 2단계	5	31	sel_at_1	19/29	4.49		discard	8문항마다 재적재, 재적재 문항 제외 p95
2026-10-01	claude	model×cand_format	qwen2.5:3b base	5	31	sel_at_1	5/29	10.94	56.7	discard	온도는 qwen 5회 직후 tj
2026-10-01	claude	model×cand_format	qwen2.5:3b v1 인용 먼저	5	31	sel_at_1	2/29	10.15		discard	
2026-10-01	claude	model×cand_format	qwen2.5:3b v2 번호	5	31	sel_at_1	10/29	14.32		discard	
2026-10-01	claude	model×cand_format	qwen2.5:3b v3 번호+색인만	3	31	sel_at_1	8/29	4.43		discard	
2026-10-01	claude	model×cand_format	qwen2.5:3b v4 2단계	3	31	sel_at_1	10/29	4.23		discard	
2026-10-01	claude	query_max_candidates	exaone3.5:2.4b 후보 1장 (QUERY_MAX_CANDIDATES=1)	3	31	sel_at_1	28/29	4.72		keep	= 검색 1위. p50 4.2s. 브랜치 feat/query-single-candidate 31e28dd
2026-10-01	claude	handover_evidence_weight×cand	exaone3.5:2.4b 인계 가중치0.5 후보5 (main)	3	20	handover_cite_hit	2/16	5.70	63.5	baseline	cite1 1/16, 검색top1 4 top5 11, 답없음 0/4, 모델 5번째 후보 13/16
2026-10-01	claude	handover_evidence_weight×cand	exaone3.5:2.4b 인계 가중치0 후보5	3	20	handover_cite_hit	2/16	7.00		discard	검색top5 8. 가중치 0.5 유지
2026-10-01	claude	handover_evidence_weight×cand	exaone3.5:2.4b 인계 가중치0.5 후보1	3	20	handover_cite_hit	4/16	5.38		keep	= 검색 1위. 인계도 후보 1장. docs/reports/model-selection-20261001.md 7절
2026-10-02	claude	retrieval_ranker	E0 단어 겹침(기준선)	5	1	tune_route_sum	82/113			keep	dev 21·sanity 29·t4 10/18·blind1 20·newhire 2/10. 조정 셋 5개 합계
2026-10-02	claude	retrieval_ranker	E2 KURE-v1 혼합 a=0.2 tau=0.60(최고)	5	1	tune_route_sum	70/113			discard	임베딩만 E1 최고 65, E3 71. 답 있음 1위 dev 9→5~7·sanity 22→17~21로 하락, 답 없음 판정도 분리 안 됨
2026-10-02	claude	retrieval_ranker	E2 bge-m3 혼합 a=0.2 tau=0.60(최고)	5	1	tune_route_sum	74/113			discard	KURE보다 조금 낫지만 E0 미달. 블라인드 2차는 채택안이 없어 열지 않음
2026-10-02	claude	retrieval_ranker	RRF 단어순위+bge-m3 k=5, 답없음 단어AND코사인0.55(최고)	5	1	tune_route_sum	83/113			discard	+1은 오차 범위: dev 1위 9→8·sanity 22→21 잃고 t4 7→8·신입 답없음 1→2 얻음. 모델 0.66GB 추가 대비 이득 없음. KURE RRF 최고 80
2026-10-02	claude	retrieval_tweak	X1 본문 어간 비교(앞 2/3글자, 가중 0.5)	5	1	tune_route_sum	77/113 (2글자), 82/113 (3글자)			discard	2글자는 흔한 어간이 겹쳐 dev 21→18. 3글자는 변화 없음
2026-10-02	claude	retrieval_tweak	X2 인계 의도 단어 → T4 가산 +2~6	5	1	tune_route_sum	82/113			discard	효과 0. 실패 문항의 1위도 T4라 T4끼리 순서 불변(T4 카드 간 혼동이 원인)
2026-10-02	claude	retrieval_tweak	X3 재가동 단서 → T6 가산 +4 (질의 모드만)	5	1	tune_route_sum	84/113			hold	+2(BL-007·BL-008)는 단서 목록을 만든 바로 그 문항. cjy 무변화. +6에서 답 없음 오수용 시작(Q-009·BL-009). 블라인드 2차 답 없음 T6 질문 7개에서 오수용 위험
2026-10-02	claude	load	MES+exaone3.5:2.4b 동시 (15W)	5	20	query_p95_llm_s	5.79	5.29		keep	J3 /api/query 블라인드 BL-002~021 순차; ok 20/20; LLM 15건 p50 4.64·max 5.79, 근거 없음 5건은 모델 없이 0.01초(전체 p95 5.29); MemAvailable 측정 전 2922MB→최저 2878MB/7619MB; swap 최대 360MB(측정 전부터); bench/jetson_query_bench.py; raw=/home/jetson/shiftlink-bench/j3_20261002_155440.jsonl
2026-10-02	claude	cnn_latency	MobileNetV3-Small ONNX (Pi 4)		200	classify_ms_p50	39.6	0.0441	66.2	keep	학습 전 모델(train.py와 같은 구조, 시간 측정 전용); Raspberry Pi 4 Model B Rev 1.5, 웹캠 640x480, onnxruntime CPU; 전처리 p50 4.8·추론 p50 34.8/p95 39.4ms; 캡처 포함 22fps; 66.2°C; bench/pi_classify_timing.py
